category,sub_category,crimeaditionalinfo
Online Financial Fraud,DebitCredit Card FraudSim Swap Fraud,"FRAUD THROUGH     DEBIT CARD
 
BANK    STATE BANK OF INDIA 

ACCOUNT NUMBER 
TOTAL AMOUNT 

PLEASE HOLD REVERSE TOTAL AMOUNT IN THE COMPLAINT ACCOUNT AND TAKE NECESSARY ACTION 
"
Online Financial Fraud,UPI Related Frauds,Complainant applied for a loan and got cheated THEY CHEATED ME IN THE NAME OF SERVICE FEE AND ANOTHER CHARGES I PAID THEM RS  TWICE BY GOOGE PAY  PLEASE SOLVE MY PROBLEM AS SOON AS POSSIBLE AND HELP ME TO GET MY MONEY BACK
Online Financial Fraud,UPI Related Frauds,INDIAAICREDITCASH OFFERED ME  LOAN AND ASK ME TO PAY  AS A SECURITY DEPOSIT THEN THEY ASK FOR  OF LOAN AMOUNT AND I REFUSE TO PAY NOW THEY DENIED TO RETURN THE DEPOSIT AMOUNT THEY SAID I ENTERED A WRONG ACCOUNT NO AND MY LOAN WONT BE DISBURSED AND MY LOAN IS FREEZED AND THEY ASKED FOR UNFREEZE MY ACCOUNT TO PAY  MORE
Online and Social Media Related Crime,Cheating by Impersonation,"                                   
	                                                                                                      
	                                        
                                                   "
Online Financial Fraud,Internet Banking Related Fraud,"Nameonkar singh 
Mobile no
Email idonkarsinghthoriyagmailcom
Account noICICI BANK  IFSC CODE ICIC
debit card no
Address cill thoriya teh bhim
Distrajsamand
PSdevgarh
pin code 
Fraud by debit card
  Rupey  DATE   TIME  PM 

 Rupey  DATE   TIME  PM 

 Rupey  DATE   TIME  PM

 Rupey  DATE   TIME  PM 

 Total amount froud  Rupey  
frouder nogoogle se sarch kiye 

        suchna karta ne bataya ki enhone icici bank ke costumer care ke no google se no lekar call kiya fir enke pass ek no se call aaya or ek anydesk application download karwa kar paise nikal liye gye"
Online and Social Media Related Crime,Cheating by Impersonation,She is Diviya VijayaKumar She is using tango app She is collected amount and cheating She is Chennai Rajesh is gov employee Chennai He is helping and sharing amount Now diviya all bank account and number blocked Now bank using Pichamuthu account and transfer amount She is changing another another account
Online Financial Fraud,DematDepository Fraud,"Not received amount withdrawn this fraud app This app fraud many people lose  lak   lak and  laks please report this issue 
This app is investment app investment   days daliy  rupees refunded in your account but not many not received amount again please report"
Online and Social Media Related Crime,Profile Hacking Identity Theft,My facebook id  priyanka singh with no  was hacked by someone  around years ago and this Id is still being operated and misused Therefore i requested you to close this account as soon as possible Thank you
Online Financial Fraud,UPI Related Frauds,"Respected sir
I am Arvind Singh Yadav So Gyan Singh Yadav from Barabanki
On th may  a person has called me and convinced me and i transferred the total  to his account I have already given a written complaint to Cyber cell and to the sp alsoBut no action has been yet taken I request you to please look into this matter so that i can get my lost money
Thank you"
Online Financial Fraud,UPI Related Frauds,Sir i received a whatsapp link regarding purchase of electric bike cycle i order the same but till the product not reach me and their website also closed company name lime contact person name riya phone no  i first pay rs  for registration and rs  for product purchase sir please help us to get the amount or product please kindly do the needful
Any Other Cyber Crime,Other,"Loan ki jarurat thi to mene bahut sare app par loan apply kiya par kisi ne bhi muze loan nahi diya baad me youtube par video dekhane par pata chala ki ye furji apps he jo data collect karke uska mis use karte he Esi liye muze subne bola tum cyber crime me complain karo 
Agar mere document ka mis use hota he to me jimmedar nahi hu sir 
Plz ye sub furji app play store me se nikal do kitne logo ko lutate honge ye lok"
Online and Social Media Related Crime,Profile Hacking Identity Theft,"Account Hacked I had filed a complain before few months But no response has been received till now I am making follow ups only I am requesting to terminate the account with immediate effect 

We have registered written complain but till now not a single response has been received We are facing very serious issue regarding Breach Of Privacy"
Hacking  Damage to computercomputer system etc,Unauthorised AccessData Breach,"Sir my name is Jagmohan my mobile number is  I have already complained in cybercrime that My mobile phone has been hacked And those people are asking me for money in the name of loan But I have not taken any loan from them And they have kept my pan card aadhar card and my photo gallery my contact list And he had also sent me my selfie aadhar card linking pan card with a vulgar video And said that we will send this video to all your contacts otherwise give us money  Sir i have screen shot in which he is saying that we can hack my mobile phone Sir these fake people hack mobiles and recover huge amount from them in the name of loan Sir they have kept my aadhar card and pan card my photos are all there My contact list has also been kept I request you that in future if anyone misuses my photos of my Aadhar card of my PAN card then I will not be responsible for that Sir my mobile is completely hacked In this that my pan card aadhar card my selfie and some photos which were in the gallery Everything has gone to him If anyone misuses these photos aadhar card pan card then I will not be responsible because I never go out of my city
Sir I have not done any wrong till date and will not do because I am a responsible person I have the responsibility of my family For which I work from morning till evening
Sir now I have decided that now I will not allow anyone to rob myself"
Online Financial Fraud,DebitCredit Card FraudSim Swap Fraud,"FRAUD THROUGH  DebitCredit Card FraudSim Swap Fraud  VISA CARD
BANK  State Bank of India
ACCOUNT NO  
TOTAL AMOUNT  

PLEASE HOLD  REVERSE TOTAL AMOUNT IN THE COMPLAINT ACCOUNT AND TAKE NECESSARY ACTION 
"
Online Financial Fraud,DebitCredit Card FraudSim Swap Fraud,mere bank se non maintance ka massg aaya our mere  bar pasie cut ho gye indusland bank se to maine goggle pr custmer care ka number se search kiya tab vha se mujhe ak number mila jis pr maine call kiya phone cut ho gya our dusre kisi number se mujhe call aaya our kha indus custmer care se bat kr rhe h aap ka jo paise cut hua h vo refund ho jayega our yah bol ker mujhe ak side di our kha process kro paise refund ho jayega our mere se atm ki sari detais lake sara paise account se gyab ho gya
Cyber Attack/ Dependent Crimes,Hacking/Defacement,"I never imagined something like this could happen to me, especially since I'm so cautious. But then I started noticing that my online activity felt different, slower even. I can't even describe it well because everything seemed normal, except for the fact that I was constantly getting logged out of my accounts. Honestly, it’s such a mess, and I don’t even know where to start. I’ve contacted support, but they keep giving me the runaround. The more I tried to fix it, the more problems came up. My social media was frezzing, and then I got locked out of everything. I don’t think I’ve ever felt this violated before. My privacy is completely shattered, and I can’t do anything to make it stop. Even my tablet isn’t working right anymore. It’s so stange how everything just fell apart after that one email."
Online Financial Fraud,EWallet Related Fraud,Customer purchased mattress on  Dec  we delivered the mattress  Dec  INR  payment received on RazorPay amount refunded by company stating fraudulent international transaction on  January after  days We have provided all services to customer  Prahsant Mishra  Please see details of phone and address in invoice MainpuriUP persons trying to commit frauds
Online Financial Fraud,UPI Related Frauds,I got a call from the person saying that he had to give my father some money by mentioning my fathers name He said he transferred the money to my phonepe account and asked me to check my account and to reassure he sent a screenshot of the transaction I didnt recieve the money on my account so I asked him about it He then said that its done from a merchant account so I will have to go to my phonepe account and accept the transaction by clicking on payment option As soon as I did that the money ie and  inr got deducted and he asked me to do it once again I got a message from bank for debiting the money rather than credited so I tried asking me about it but he tried confusing me saying that this is how it works Finding this fishy I tried contacting my father to reassure about it and tried putting them on conference call He then didnt respond and never picked my call again
Online Financial Fraud,UPI Related Frauds,They said me they will give loan and then they asked for processing fee of  rupees i paid and they asked again for TDS money  rupees and now they are asking for GST  rupees they said they will give loan but they frauded me and now they are forcing me to pay  rupees please help me i want my money back I am a avg working person they have taken all my money i am  now and now they are forcing me to ask to my friends i wanna give now i am tired
Online Financial Fraud,DebitCredit Card FraudSim Swap Fraud,"sir
on  without my knowledge continuously amount debited from my indusdind credit card while the incident OTP also came continuously and amount has been debited without my knowledge After i realised it was a fradulent transaction  i immediately blocked my credit card please help to recover my amount i have attached the screenshot"
Online and Social Media Related Crime,Cyber Bullying  Stalking  Sexting,"this is to bring to your kind notice reference id of the last acknowledgement no  
person named PRIYANKA SETHI impersonating as kulta dhawan is defaming our family by posting our pictures and harrasing us by writing absurd comments which are very painful and defaming between family friends and society  I request you to take strict actions "
Any Other Cyber Crime,Other,message on my whatsapp for a loan recovery which is fake as i have not taken any money from this particular app name KOKO App which unknowingly sent me  and asked me to pay a amount of  which i have paid in fear but they still disturbing me
RapeGang Rape RGRSexually Abusive Content,,"Respected Sir

A very serious matter I want to inform you Few person running or involve in some very shamefull activities by using few women at many places of kolkata gariahat ballygunge RUBY HOSPITAL BEHIND area KASBA ANANDAPUR QUEST MALL metropolis mall area ACROPOLISMALL area park circus FORUM MALL ELGIN RD Parkstreet MAIDAN AREA esplanade Garia jadavpur BEHALASAKHERBAZAR JOKA BANSDRONI  Rabindrasadanexide area  HARIDEVPUR triangular park lake mall area rashbehari area TOLLYGUNGE THAKURPUKUR BBD BAG DALHOUSIE AREA  and SALTLAKE

Their name 
SUBHRO SAHA AMLAN DATTA 
IZAZ AHMED Anirban


They officially work in a insurance office hdfclife  a hindustanpark ab gariahat shopping mall st floor beside of reliance trend building near gariahat more  but outside at several places  they involve in some shamefull activities last years

Sir a person SUBHRO SAHA forcefully involve few women employee ex FEMALE employee in such shamefull doing

At afternoon evening or after evening or night time they doing this shamefull activities

Many innocent people are TRAPPED and suffering in such dirty issue for long time
They are even  to lodge a complain against them because of  threatening and blackmailing ISSUE


From above  address PLACES and their mobile whatsapp no  you can easily trace and track their all activities You need to investigate Last years detail


Please help"
Online Financial Fraud,UPI Related Frauds,There this guys states that he can double the money in  mins also i came across this page on telegram call AmazonXard  where she sell mobiles at cheap rate so msged some called veer singh he promised to double the money in  mins so waited for  mins after the transfer after that this person blocked me on telegram and all his chats were deleted instantly ao have no proff of the chat but have proff of the transaction
Online and Social Media Related Crime,Cheating by Impersonation,"Dear Team 
Yesteday  I have received a call from mob no  and the person told me that he  is speaking on the behalf of youtube and someone 
 trying to upload  my nude video  on  youtube and to stop this video  he ask me for money
Here i am shareing more details in the attachmetnt and  I have a recordings also I have also received a fake call form cyber crime and ask me to deposit money for the same 
name of the Person Hamet kumar
account  no 
bank name ICICI BANK
BRANCH  DELHI
IFSC CODE ICICI"
Sexually Obscene material,,"I opened a watsapp link on a dating site  I clicked on it and after that I received a video call When i opened it for the first  seconds i couldnot understand what it was then suddenly i saw a nude girl at the top Within next  seconds I ended the call I received call  times again from that number Sadly i couldnot keep a track of the number as I ended that chat and cleared the contents The I received a watsapp from the number  of me watching a video though I had no reaction in the video I did not undress or do any sexual act of any nature  After that around  at night I received threats of publishing the video online in every platform and sending to my close friends and near ones They had taken out a lot of details beforehand from my facebook account as you will see in the video I have uploaded In fear of my reputation and constant threats and screenshots sent to me of sharing the video I gave into thier demands and paid them in total  via paytm bank accounts I have shared all the payment details in the file uploaded Their bank account details are AC No  ICICI Bank Ltd IFSC CodeICIC and Pay Tm Number         bearing name of Akash Kumar  Deepak Kumar
After i paid such amount they said they have deleted everything with them and I have shared the video they sent me  I am still in state of utter stress and having suicidal thoughts and fear that they may again harass me Please help"
Online Financial Fraud,DebitCredit Card FraudSim Swap Fraud,ATM me jane ke baad hume  rs nikalna tha but us time atm masin kisi karan bas paisa nhi withdrow kr ska uski ke turant badh mere account se pura  rs ka withdrwo ho gya hai wo bhi atm masin se
Online Financial Fraud,Internet Banking Related Fraud,I tried to call Flipkart to get my refund and they call me back from  and asked me to install anydesk app and the fraud is done through call two transactions have been done during the call
Online Financial Fraud,UPI Related Frauds,"Two person are involed 
Contact No 
                      
In MONSTAR WEBSITE I HAVE UPLODED MY RESUME AND THEN THROUGE WHATS UPP OFFERD WORK OF DATA ENTRYAND THEN HE DAMANED ENROLLMENT FEES AND THEN OAID BY ME THEN I REALISED IT IS FRAUDE BACAUSE NO COMAPYLLP IS EXISTED Financial Fraud"
Any Other Cyber Crime,Other,Olx me mujhe mobile mila tha fir watsapp me deal kiye the cash on delivery fir bhi ensuranc gst warrenty ke name par mujhse thoda thoda kr pura paisa le liye fir bhi unki company ye sara amount ek sath mang rhi thi to maine ye sara amount pay kiya bole ki ye  k apko bat krte krte wapas kar diya jayega but update nai mil rha kar ke next dy mil jayega next day bolte h ki apka ordee cancel ho gya h ap ek form fill kar do apko apka paisa mil jayega bole maine form fill kiya fir do char din wait kiya aise krte bhot din ho gya fir call krta hu msg kiya koi raply nai diye fir maine complain kiya compain krne ke kuch din bad fir call krke ke bolte h ki ap complain wapas le lo apka paisa mil jayega request krne ke bad bhot socha fir maine complain wpas liya fir bhi mujhe dhokha de diye ab fir se call msg ko ignore kar rhe unka no Mere pas h 
Online Financial Fraud,EWallet Related Fraud,"rohit mathur so shailendra mathur email idmathurrohitgmailcom  address sohan sajjan bhawan rani bazar  pin code  ps kot gate disst bikaner se suchna karta ne btaya ki es no se whats up pe  massage to paytm se fraud kar liya h 

suchna karta ki paytm idpaytm  link by ac  AXIS BANK   IFSC UTIB    AU BANK   IFSC AUBL 

ST TRANSACTION ID    DATE   TIME  PM  RS 

ND TRANSACTION ID  DATE   TIME  PM  RS  

RD TRANSACTION ID   DATE   TIME  PM  RS 

TOTAL FRAUD "
Online and Social Media Related Crime,Provocative Speech for unlawful acts,"                                                                                 
              "
Online Financial Fraud,UPI Related Frauds,"FRAUD THROUGH 	phonepe 
BANK NAME sbi bank   		
ACCOUNT NUMBER  
TOTAL AMOUNT  	
PLEASE HOLD REVERSE TOTAL AMOUNT IN THE 
COMPLAINT ACCOUNT AND TAKE NECESSARY ACTION SHRI MAN PRARTHI ASHISH KUMAR VARMA JO KI BAHUT HI LACHAAR HAI USKI HAR SAMBHAV MADAAD KI JAY PAISA WAPES HO  TATHA PHON KARNE WALE VAKTI MOB  KO AWASYAK ROOP SE DAND DIYA JAYE TAAKI BHAVSHYA ME KISI OR KE SAATH VO VYAKTI AISI GHATNA NA KAR SAKE VYAKTI PHON NO KABHI  UTHATA HAI BAT BHI KARTA HAI KAHTA KOI MERA KUCH NAHI BIGAAD PAYEGA"
Online Financial Fraud,Fraud CallVishing,My self incident to dhani personeal loan walo ne koya hai jo fake haie aur vo mere somthing  rs nikal chuke hai aur v maang rahe hai whatts up msg kar rahe hain ke aur payment karo  ka health bimma karwao
Online Financial Fraud,Internet Banking Related Fraud,Multiple transactions done at Paytm and online icici IMPS transfer to sameersaxena  Total amount  Transactions of      Bank ac Fed bank IFSC FDRL  ac no 
Online Financial Fraud,DematDepository Fraud,fraudster added my number in whatsapp grp made by  and and  and asked to make account on xkwtpcommobile under second contract trading then advice to trade Bitcoin after successful profit they demanded their commission in dollars in coin wallet and then banned withdraw i have lost  in these frauds site is still active and my login id is still valid
Any Other Cyber Crime,Other,"Details of Blackmailers
Phone numbers         
Account number 
IFS CodeHDFC
Amount paid Rs 

sir fb pe mujhe ek ldki ki request aayi thi mene accept kiya to hmari baat huyi thodi or usne mera number le liya fir mujhe video call kiya wo nude thi dusri side or usne mera wo video record kr liya or ab mujhe blackmail kr rhe hai mujhe cyber crime ke name se call aa rha hai or wo log bhi paise maang rhe hai sir abhi tak mujhse k le chuke hai  pls meri help kijiye mera video delete kra dijiye and mera amount recover kra dijiye"
Child Pornography CPChild Sexual Abuse Material CSAM,," underage sexual videos posted on a discord server httpsdiscordcomchannels

By username talibani  on th Feb  I got to know about this only a few minutes back 

Last month I complained to discord regarding this channel and illegal materail but channel is still there"
Online Financial Fraud,Internet Banking Related Fraud,I received an SMS at  pm on th Jan  to link my HDFC card to my PAN on my mobile When I followed the link and entered my PAN card details I got an SMS at  pm confirming debit of  from my account
Hacking  Damage to computercomputer system etc,Unauthorised AccessData Breach,Pending dikhte dikhte payment dal diye processing fee zero baat Aakar payment kat liye aur blackmail karne ki dhamki de rahe hain Aadhar Card block karne ki dhamki de rahe hain sister ko blackmail karne ki dhamki de rahe please meri help kariye mera contact bhi hai kar liye hain gandi video bhejne ki dhamki de rahe hain
Any Other Cyber Crime,Other,I applied for a Loan I got a call from a guy from Bajaj Finance company I have sent all the documents on this Mobile No  in Whatsapp after that he sent me the Loan Approval letter and thereafter asked me to pay Rs  I paid the same on Bank A c Bank Name Canara Bank Name  Bajaj Finance A C No  IFSC No CNRB In this Ac No I Have Paid Rs plus   as the amount for Processing Fee  TDS Hold Fee Thereafter the guy told Me to pay more  Rs  But I have done only  Transactions on the account have paid for processing fees
Any Other Cyber Crime,Other,"SCP DHANAPAL SO LATE CHINRAJ
SUNIL MANAGER
GS MUTHUKUMAR
FROM THIRUVARUR ALL ARE CHENNAI REAL PROMOTERS ALL THERE ARE CHEATED ME RUPEES FOURTEEN LAKHS TWENTY THOUSAND ONLY
PLEASE TAKE SERIOUS ACTION VERY SOON"
Online Financial Fraud,Fraud CallVishing,I got a call from someone stating they are calling from Amazon They had my mothers address name and order history from Amazon They said we are eligible for some promotional gift but we have to make a Rs purchase first Purchase happened outside of Amazon app Post purchase they said they are facing issues with the GST of the promotional gift and so we are required to submit the GST amount worth Rs to them to ensure that the order is properly placed Only once that happens will the order reflect on our respective amazon account On refusing to pay more the guy said that he cant help it He cant cancel transaction
Online Financial Fraud,UPI Related Frauds,"FRAUD THROUGH  UPI FRAUD PAYTM 
BANK  PAYTM PAYMENTS BANK 
ACCOUNT NUMBER  		
TOTAL AMOUNT   						
PLEASE HOLD  REVERSE TOTAL AMOUNT IN THE COMPLAINT ACCOUNT AND TAKE NECESSARY ACTION"
Online Financial Fraud,UPI Related Frauds,UPI FRAUD RS 
Online and Social Media Related Crime,FakeImpersonating Profile,"Onstream Loan App on playstore on playstore accessed my contact details my aadhar card details pan card details and bank statement illegally harassing me by texting on whatsapp in a foul and abusive way calling me feom different numbers and asking money fake documents created and saying thay they message on my contact about fake bad things mentioning numbers they used in exploiting thousands of people and u also can see reviews of this app on playstore almost they make people to suicide so please take serious action against the app and also these below contact numbers 
  
  "
Online Financial Fraud,Internet Banking Related Fraud,A sms from the number  came and asked me to to kyc of my bank account detailed was asked and DOB also asked websites was same as netbanking and logged in by asking otp After submitting OTP they deduct MTOPUP of  from my bank account soon i logged out and lock the Internet banking from customers care sbi
Online and Social Media Related Crime,Profile Hacking Identity Theft,"I am Dev Joshi an Actor in India  my Facebook page was hacked on February  at Midnight by a hacker The hacker used the method of severe coding and became the Admin of my Facebook Page after which he removed me and my Manager as Admin and then posted unauthorized random content which is getting copyright violation

I tried to connect to Facebook help and reported the same but they are only saying that a Facebook page can only be hacked through a Facebook Account while in my case none of the accounts were hacked and directly the page was hacked through severe coding which the Facebook team is not understanding

I also tried to connect to the Grievance Officer of Facebook India but she is also not responding There is no direct way I can connect to Facebook and make them understand the situation as they have no customer care number or email address

There are more than  lakh followers on my Facebook page and the hacker which is operating most probably from Pakistan will misuse this reach and information to hinder and hurt the Indian values and Integrity

I request your urgent attention to this matter"
Any Other Cyber Crime,Other,I downloaded the Cattle Farm app from Google Play Store and I invested a  huge amount in the said app The app promised to double the amount whatever I was investing I used to get the money initially and got it till December and now I have stopped getting the money and am supposed to get near about Rs  from the said app
Online Financial Fraud,DebitCredit Card FraudSim Swap Fraud,"This is to inform you that yesterday on dt  I had transferred money through Google pay of amount    to Account OF SBI then it was not transferred at that time so I called to customer care of SBI toll free no  and then the person who received call at SBI customer care told me to install app named ANY DESK REMOTE DESKTOP SOFTWARE and then he cuts the call and calls me from their own no  and then after that just few seconds later I have lost my rs  from account

So it request you to do the needful and refund my amount of rs  as soon as possible 


Regards 
Sakshi Nag"
Online Cyber Trafficking,Online Trafficking,"I have received a notification by chrome he say I won a scratch card  I scratched the card then my account balance is deducted please help me
I am a poor farmer Please catch the hacker and my money "
