category,sub_category,crimeaditionalinfo
Online Financial Fraud,UPI Related Frauds,I was addvertisement in OLX for selling fridge on dated  and Anil kumar was agree and which mobile number is  But Anil Kumar has frauded with me and also was saying Army officerSo I request try to take appropriate action please
Online Financial Fraud,UPI Related Frauds,"FRAUD THROUGH  UPI FRAUD PHONE PE
BANK NAME Punjab National Bank including Oriental Bank of Commerce and United Bank of India	
ACCOUNT NO 
TOTAL AMOUNT  
PLEASE HOLD REVERSE TOTAL AMOUNT IN THE COMPLAINT ACCOUNT AND TAKE NECESSARY ACTION"
Any Other Cyber Crime,Other,Hi on  I had withdrawn an amount of  from my nearest ATM from the PNB branch However after some time I noticed that an amount of Rs  was debited from my account A transaction of  rupees was done  times which adds up to  Before the amount got debited I also received a message regarding credit of  rupees in my account As soon as noticed this I had blocked my ATM pin and have also reported this incident to ICICI bank with all the required documents I have submitted a photocopy of my front ATM card and a photocopy of my ID proof in the nearest ICICI bank which Vasundhara Enclave branch
Online Financial Fraud,EWallet Related Fraud,"I have advertising business on Instagram so I have clients from all over the world  my one of client transferred money through skrill wallet and I did not receive it so I contacted skrill wallet customer care  He told me invest  so that I can receive my clients money he told me to follow steps and I did then after investing money he told me that i paid money after some time span expiry  then he told me to pay again  rs same amount so that I can receive my all money plus my clients money and he provided me another UPI id  After paying second amount he told me to wait for  min I waited after  min I called him and he said your client has requested for refund so your account is under in suspicious activity  I told him to help he said he can not help until I do not pay same amount to him
His contact no is given below 
 
"
Sexually Obscene material,,Please report this number  for abusive words and sharing abusive sentence reported in WhatsApp chat from Delhi The incidents happening from long time along with threatened words please look the same asap
Online and Social Media Related Crime,Cheating by Impersonation,"Contacted olx seller for second hand ps looked genuine seller he mentioned in olx add that he is from indore but later I found out he is a distributor from kolkata and delaer from current india technology which I check the company with this name existed so I though it is as genuine and made advance payment of  said it will reach with in  days happened on  jan but not got delivery not picking phone and replying to mail 
They were imposters

Mail retaillimitedcurrenttechnologygmailcom
Seller  
Seller  "
Online Financial Fraud,EWallet Related Fraud,"They have an app called M Smart Recharge from which cheating starts giving  cashback to recharge
UPI is asked to add money money is deducted from the bank but is not added to the wallet cannot be contacted cannot be asked for refund"
Any Other Cyber Crime,Other,Al India credit and cash loan application fraud and took  from me to release the amount also now asking for  more to release the amount which I paid I said I want my money which I have paid to get loan
Online Financial Fraud,UPI Related Frauds,Fraud Amount Rs 
Online and Social Media Related Crime,FakeImpersonating Profile,"Iss person ne mere sath  ka froud kiya h ye person khud ko army man bolta h iska no ye h   inhone mujhe online phone dikaya tha uske liye inhone mujh se phle  phonepe karvaye uske baad mint k baad or phone pe krvaye or bola kal apko parcel phoch jayege uske baad baje subh call aayi ki apka parcel phoch gya h aap baki k pese pahle daal do unhone mujhe account no bejha jo ye h Ac  
Name  Post Office
IFSC code  FDRL
FEDERAL BANK
Mane inke account mai baki ka amount Paytm k though  bejh diye fir bhi uske baad fir usne mujh se rupees mange or mane dene se mana kr diya to unhone mujhe parcel dene se mana kr diya mere pass amount k sare translation save h or sabhi screenshot h please aap meri help kro"
Hacking  Damage to computercomputer system etc,Unauthorised AccessData Breach,Sar please meri help kijye maine  ka loan liya tha phir maine de diya pura lekin maine civil score check kiya usme dikha raha hai me maine bahut loan liya hai lekin maine sar khali  ka liya tha pir pay bhi kar diya tha sar please meri help kijye
RapeGang Rape RGRSexually Abusive Content,,"Respected Sir

A very serious matter I want to inform you Few person running or involve in some very shamefull activities by using few women at many places of kolkata gariahat ballygunge RUBY HOSPITAL BEHIND area KASBA ANANDAPUR QUEST MALL metropolis mall area ACROPOLISMALL area park circus FORUM MALL ELGIN RD Parkstreet MAIDAN AREA esplanade Garia jadavpur BEHALASAKHERBAZAR JOKA BANSDRONI  Rabindrasadanexide area  HARIDEVPUR triangular park lake mall area rashbehari area TOLLYGUNGE THAKURPUKUR BBD BAG DALHOUSIE AREA  and SALTLAKE

Their name 
SUBHRO SAHA AMLAN DATTA 
IZAZ AHMED Anirban


They officially work in a insurance office hdfclife  a hindustanpark ab gariahat shopping mall st floor beside of reliance trend building near gariahat more  but outside at several places  they involve in some shamefull activities last years

Sir a person SUBHRO SAHA forcefully involve few women employee ex FEMALE employee in such shamefull doing

At afternoon evening or after evening or night time they doing this shamefull activities

Many innocent people are TRAPPED and suffering in such dirty issue for long time
They are even  to lodge a complain against them because of  threatening and blackmailing ISSUE


From above  address PLACES and their mobile whatsapp no  you can easily trace and track their all activities You need to investigate Last years detail


Please help"
Online Financial Fraud,UPI Related Frauds,"
FRAUD THROUGH  UPI FRAUD GOOGLE PAY
BANK   STATE BANK OF INDIA 
ACCOUNT NUMBER  
TOTAL AMOUNT  
PLEASE HOLD REVERSE TOTAL AMOUNT IN THE 
COMPLAINT ACCOUNT AND TAKE NECESSARY ACTION"
Online Financial Fraud,UPI Related Frauds,had put my old furniture item on OLX as Aanandsing Patil Then i got call from Santosh Muwel on  November  his mobile no is  then that person sent me his Paytm QR code and then I scanned that QR code  times and then amount of  rupees debited from my account and also after that another transaction of rupees  debited from my account However they did not refund me any of my money till now and not responding to my calls
Online Financial Fraud,UPI Related Frauds,"FRAUD THROUGH PAY TM


BANK IDBI BANK 

ACCOUNT   NO  

TOTAL AMOUNT 


PLEASE HOLD REVERSE TOTAL AMOUNT IN THE 
COMPLAINT ACCOUNT AND TAKE NECESSARY ACTION
"
Online Financial Fraud,Internet Banking Related Fraud,FRAUDULENT TRANSACTION  I have received a message from mobile no   it include a link setting my yono bank Then i visited the website and given details  Then one OTP have received  I typed that OTP in that website Then immediately debited rs from my bank account
Online Financial Fraud,UPI Related Frauds,"FRAUD THROUGH PAYTM 
 BANKSTATE BANK OF INDIA 
ACCOUNT  NO   
TOTAL AMOUNT	
PLEASE HOLD  REVERSE TOTAL AMOUNT IN THE COMPLAINT ACCOUNT AND TAKE NECESSARY ACTIONand help me to refund my balance"
Online Financial Fraud,UPI Related Frauds,unknown call fraud  rstransfer my account no  hdfc bank ac no  branch saket I am already add the proof  and money transfer this num  person name is anil  sharma  call time  pm
Online Financial Fraud,Fraud CallVishing,Many number message me some volgour messages and threat me that they hacked my phone or damagaed my social reputation And call my relatives and frnds threatened to them and uses abuse words They call me and messages me every minutes
Online Financial Fraud,UPI Related Frauds,"FRAUD THROUGH UPI FRAUD PHONE PE 
BANK  STATE BANK OF INDIA  
ACCOUNT NUMBER  
TOTAL AMOUNT 	
PLEASE HOLD REVERSE TOTAL AMOUNT IN THE 
COMPLAINT  ACCOUNT AND TAKE NECESSARY ACTION"
Online Financial Fraud,DebitCredit Card FraudSim Swap Fraud,FRAUDULENT TRANSACTION
Online Financial Fraud,UPI Related Frauds,SIR MAINE ONLINE CUSTOMER CARE KA NUMBER SAERCH KIYA USPAR BAAT KARNE KE BAAD SE MERA MOBILE KISI OTP KE JARIYE HACK KAR LIYA GAYA OR USKE BAAD LAGATAR  TRANSACTION SE MERE ACCOUNT SE  RUPEY NIKAL GAYE JISKE LIYE REQUEST PESH HAI
Online Financial Fraud,EWallet Related Fraud,This guys is scammers because he has done scam with me on  December because file and command is not working properly and second thing he is removing other file license and doing nulled in others file so take action as soon as possible on this this whatsApp number   
Any Other Cyber Crime,Other,"SOME PERSON USING MY ADHAR CARDPAN CARDBANK DETAILS FOR ONLINE PERSONAL LOAN THROUGH  DHANI APP  AS PER CUSTOMER CARE EAST PATEL NAGAR CARD IS BEING USED IN BANGLORE WITH DIFFERENT MOBILE NO
PLS FIND THE ATTACHMENT FOR MORE DETAILS"
Any Other Cyber Crime,Other,"Hi Sir This is Vidya Sagar from South Delhi 
mene apne SBI Credit card ko band krwane ke liye Customer care par call kiya but jo ye number hai  
Unhone phone utha kr  sawaal puche or fir usne kaha sir apka card band ho jayega lekin apko kuch steps follow krne honge 
Uske baad usne naam address pucha ki conform kr rhe hai fit usne kaha ki sir apke pass OTP ayega vo aap mujhe bata do Ab mene khud se customer care par kiya to iss vishwas se mene usko OTP bata diya lekin usse pehle mene uska naam bhi pucha to usne kaha sir mera naam deepak hai or me SBI credit card department se bol rha hu or apka koi pessa nhi deduct hoga Me  saal ka admi iss vishawas par chal padha ki sach me esa kuch nhi hoga jab ki mene uss number par kiya hai jo credit card ke back side pr diya hua hai 
lekin mere pesse deduct ho gye  INR jiske mene Screenshots bhi liye hai or PDF bana kr sab mention kr diya hai with FIR but ye conformation mujhe febuary month me hui jab mere card ki statment ayi to me to daar hi gya ki ese kese ho skta hai 
iske baad SBI ki head brand Parlement stage par gya tha unhone bataya ki ese steps follow kro to isliye me yaha par complaint kr rha hu 
Please help me me SBI ko pessa nhi de oayunga qki meri itna salary hi nhi hai 

thank you 
Regards 
Vidya Sagar
Ph  "
Sexually Obscene material,,Use of my photo to an article without my permission or knowledge Page owner not receiving the call nor responding I just want my pics to be removed from such articles as it is impacting my image Please help me in taking the action against the channel
Online Financial Fraud,Fraud CallVishing,The person called me and claiming that he is from mudra loan website and was giving me a loan of rupees lacs and before disbursting the amount he asked for the processing fees he at first he was asking for  rupees for processing the loan amount then he said  rupees will be enough i will manage
Cyber Attack/ Dependent Crimes,Denial of Service (DoS)/Distributed Denial of Service (DDOS) attacks,"My friend mentioned something like this happened to them a few months ago, but I thought it was a one-off. Then, suddenly, I got this weird notification asking me to update my password, but the message didn’t look like the usual ones I receive from the app. It looked a bit off. I don't know how, but it’s like they knew everything I was doing, even though I was trying to be careful. It’s terrifying to think about. The more I tried to fix it, the more problems came up. My bank account was stange, and then I got locked out of everything. The worst part is, I don’t even know who to trust anymore. Friends, family, everyone’s acting strange. It’s affecting my relationships and my mental health. Even my tablet isn’t working right anymore. It’s so stange how everything just fell apart after that one email."
Any Other Cyber Crime,Other,I am receiving unwanted orders from ola Someone is ordering multiple commodities through my account and sending them to my home My ola money is also deducted I am also receiving the transaction messages regarding the same Also  came to see some money is due on ola postpaid And I have not made any payments through ola postpaid I have also made a complaint at ola support But they denied taking any responsibility
Online Financial Fraud,DebitCredit Card FraudSim Swap Fraud,They are fraud with phone call by debit card and credit cardthey behave like customer service they fraud with ATM card  and credit card  they fraud with otp and ask for download some app
Online Financial Fraud,Internet Banking Related Fraud,Victim has been defrauded by miscreant at the time of selling thing in  OLX Total Fraudulent amount is 
Any Other Cyber Crime,Other,I had noticed an advertisement on a social media and then wanted to buy it from the respective site namely Cartify dot com then we placed the order for  items and received only  then we contacted them to say that what we ordered and what came was totally different and then they blocked me
Any Other Cyber Crime,Other,I was trying to buy a refurbished phone through Quikr in which this vendor asked me to pay upfront I did the payment on December   but till date I have neither received the phone nor the refund The person has been constantly delaying it and has not given anything as yet
Online Financial Fraud,UPI Related Frauds,"FRAUD THROUGH  UPI Fraud PHONEPE 
BANK  State Bank of India
ACCOUNT NO 
TOTAL AMOUNT  

PLEASE HOLD  REVERSE TOTAL AMOUNT IN THE COMPLAINT ACCOUNT AND TAKE NECESSARY ACTION 
"
Online Financial Fraud,UPI Related Frauds,CALLER INFORMED THAT SHE SEARCHED OLA ELECTRIC SCOOTER IN GOOGLE SHE GOT ONE NUMBER AND PAID AMOUNT BY GOOGLE PAY LOSSESD AMOUNT
Online Financial Fraud,EWallet Related Fraud,I found one message daily  return in minimum investment and  risk free and one link down lod I belive and downlod This apo one month work but  to days till now not work not responce please how to refound my money please kindly help me
Online Financial Fraud,DebitCredit Card FraudSim Swap Fraud,"Identity theft   Smishing SMS Fraud  CreditDebit Cards Fraud  Reward Points
victim got a SMS with a link stating that he has won reward points so he clicked on the link and lost money"
Online Financial Fraud,UPI Related Frauds,"FRAUD THROUGH upi phone pe 
BANK  bank of baroda
ACCOUNT NO 
TOTAL AMOUNT 

PLEASE HOLDREVERSE TOTAL AMOUNT IN THE COMPLAINT ACCOUNT AND TAKE NECESSARY ACTION"
Online and Social Media Related Crime,Cyber Bullying  Stalking  Sexting,I got a friend request on fb named sapna sharma then next day she asked my whatsapp number On  she suddenly video call me and removing her clothes i was shocked and donot understand what to do then she told me to remove my cloth but i refused her by telling her their is cold outside but she record my video by screen recording  after that she blackmail me that she were uploading my video on youtube facebook and send it to my family member but i didnot response her till one hour then she msg me from another number  but i didnot response her then she stopped msgs me and did not send my video to my family member but today an unknown person called me no and told me that he is arun saxena from cyber crime branch and told me about my video and told me to remove my video from social media and gave me another number by telling that the number is from mumbai youtube noand they delete your video but when i call them a person rahul said that you have to deposited Rs to delete the video and if you have no money then Rs to hold the video for a week he is forcing me by said that you have to go to jail for  years and fine Rs urgent send money to us to delete the video Sir i request to please help me into this matter please look into the matter i am very afraid of infamy for me and for my family Please help me and please private my documents and number also
Online and Social Media Related Crime,FakeImpersonating Profile,"To
     The SSP
     Etah

Sir
     It is requested that i am getting calls and messages from unknownnumbers on my mobile number and whatsapp number When I talked to  a Person having mobile no   he told me that he got my mobile no from facebook account Sarika Sarika Singh URL httpswwwfacebookcomsarikasarikasingh
below are few other nos from which i got calls

     
      
      
   

Sir It is requested to look into the matter and take appropriate action

                                                      Applicant
                                                  Archana Nigam
                                                wo Chandresh Kumar
                                               Ambedkar Nagar Etah
                                               "
Online Financial Fraud,UPI Related Frauds,"FRAUD THROUGH  PHONE PE 
BANK STATE BANK OF INDIA 
ACCOUNT NUMBER    
TOTAL AMOUNT   
PLEASE HOLD REVERSE TOTAL AMOUNT IN THE COMPLAINT ACCOUNT AND TAKE NECESSARY ACTION

I was searching for the customer care number for Airtel due to unsuccessful rechange of my airtel sim and found this number  I have dialed this number and asked for the status of my recharge He told me to install an app  any desk  on my mobile After that he told me now I have to do the transaction again as the previous transaction of recharge was failed He asked to put  SWON ECOM my four last digits  to  on my screen then I received an SMS on my phone Then he told me to open  Phone pe  app and enter the details of your ATM I have entered my ATM details and expiry date etc on my mobile and when I entered CVV on my mobile then money got detected from my account the phone got disconnected and I have received an SMS from SBI that my money INR  have got deducted from my account 

For a few minutes I was in shock  Then I asked the same with some of my friends what to do in such a case then I raise the complaint after  minutes"
Online Financial Fraud,Internet Banking Related Fraud,the complainant called the custemercare to report to report the complaint of refund issue in few minutes he received a call addressing as sbi customercare  they told the install the app after some time  rs debited from the account
Online and Social Media Related Crime,Cyber Bullying  Stalking  Sexting,Someone is randomly creating fake secret chats on Telegram and threatening to photoshop image and leak them on internet An using secret chat to disappear and contact from other chat again There is many fake ids from which the impersonator is contacting And the person is claiming from unacademy
Online Financial Fraud,UPI Related Frauds,"The fraudster contacted me through whatsapp impersonating as one of my close friend and described that there has been some incident and is need of money He gave another mobile number to transfer the fund through gpay and also shared one upi id
Whatsapp mobile number of fraudster 
Mobile number to which money transfer happened 
UPI id shared with me Wolficici"
Online Financial Fraud,Internet Banking Related Fraud,Got an SMS contain updating PAN CARD details in fake SBI YONO website on  FEBRUARY  at  pm of an amount Rs   is debited from my account As I informed to same branch they instructed to call the toll free number  and complainted
Online Financial Fraud,Fraud CallVishing,"I do not know where this person got my contact details and he has allured me by whatsapp to enter into the lottery but I understood their steps in the first stance 
Please take strict action against these fraudsters 
Because of these peoples  many innocent persons loose their hard earned money "
Online Financial Fraud,UPI Related Frauds,"FRAUD THROUGH  UPI PAY TM 

BANK  CANARA BANK 

Person named Bittu called to inform me that Vivek sharma recommend someone to do bisiness with us Pintu connect us with Fraud person on the recommendation of Vivek Sharma who kived in Saket colony Surendra Nagar

ACCOUNT  NO 

TOTAL AMOUNT  

PLEASE HOLD REVERSE TOTAL AMOUNT IN THE 
COMPLAINT ACCOUNT AND TAKE NECESSARY ACTION"
Online Financial Fraud,EWallet Related Fraud,"Some one has utilized my Zest Money Wallet vouchers through Amazon Pay balance Without my consent  worth amazon coupon got credited in my Zest money wallet in the month of February  I got to know there are vouchers in my wallet around October  I went to Sangeetha Mobile store on th January  Evening and shown to him He shared some screen shots and said vouchers are already utilized Supportings for the same are attached Please help me out of the Issue
Thanks and Regards
Kummari Narender
Phno 
Altenate "
Online and Social Media Related Crime,Cyber Bullying  Stalking  Sexting,                                                                                                                                                                               
Sexually Explicit Act,,"The person is sending inappropriate and threatening emails He is sending his address and aadhar number and calling to meet ecen though there have been made multiple requests to him to stop contacting He even publically shamed the person putting stories on Instagram and is sending unsolicited messages on all messaging platforms WhatsApp telegram even Paytm Even after being blocked and reported multiple times he still sends messages asking to come and meet containing sexually inappropriate content These are shameful and scary and have disrupted my life very much
He claims of knowing and loving even though there has never been any relationship He has the contacts as he was once a senior in college 
Please do anything possible in your hands to make him unable to contact and help in any way you can 
It will be very helpful thank you very much in advance
I do not wish to reveal my identity"
Online Financial Fraud,UPI Related Frauds,Online Google Fraud from Yono app
Any Other Cyber Crime,Other,"I am Aarti Devi an account holder of State Bank of India with account no  writing this complaint letter to bring to your notice some fraudulent transactions being done from my account On th October  at  PM I received a couple of four text messages citing  Rs  Rs  Rs  and Rs  has been debited from your account  which took me by surprise as I have my ATM card and other sensitive details with me only and have never shared with anyone
with this complaint I have also attached my account no concerned transactions details
I request you to please look into the matter and took swift action to recover my money lost and I will be looking forward to the same being credited in my account
Your promptness in this regard will be highly appreciated
Thanks for your service
Your sincerely
Aarti Devi"
RapeGang Rape RGRSexually Abusive Content,,"Respected Sir

A very serious matter I want to inform you Few person running or involve in some very shamefull activities by using few women at many places of kolkata gariahat ballygunge RUBY HOSPITAL BEHIND area KASBA ANANDAPUR QUEST MALL metropolis mall area ACROPOLISMALL area park circus FORUM MALL ELGIN RD Parkstreet MAIDAN AREA esplanade Garia jadavpur BEHALASAKHERBAZAR JOKA BANSDRONI  Rabindrasadanexide area  HARIDEVPUR triangular park lake mall area rashbehari area TOLLYGUNGE THAKURPUKUR BBD BAG DALHOUSIE AREA  and SALTLAKE

Their name 
SUBHRO SAHA AMLAN DATTA 
IZAZ AHMED Anirban


They officially work in a insurance office hdfclife  a hindustanpark ab gariahat shopping mall st floor beside of reliance trend building near gariahat more  but outside at several places  they involve in some shamefull activities last years

Sir a person SUBHRO SAHA forcefully involve few women employee ex FEMALE employee in such shamefull doing

At afternoon evening or after evening or night time they doing this shamefull activities

Many innocent people are TRAPPED and suffering in such dirty issue for long time
They are even  to lodge a complain against them because of  threatening and blackmailing ISSUE


From above  address PLACES and their mobile whatsapp no  you can easily trace and track their all activities You need to investigate Last years detail


Please help"
Online Financial Fraud,EWallet Related Fraud,"This guy has created a whatsApp profile in my name and asking my friends and family to transfer money on UPI  chandmeybl he is texting everyone and asking for money from his number   
this number is marked as spam by  on truecaller
Please take action as soon as possible before he loots anyone"
Online and Social Media Related Crime,Profile Hacking Identity Theft,The above attached image is of my female friend chat with the culprit in which he asks for her nudes The culprit is texting my all friends and threatening me I want to know the culprit and want my instagram id to be permanently disabled immediately so that he cannot misuse my id
Online Financial Fraud,UPI Related Frauds,"FRAUD THOROGH UPI PAY TM 
BANK PUNJAB NATIONAL BANK  
ACCOUNT NUMBER 
TOTAL AMOUNT  
PLEASE HOLD REVERSE TOTAL AMOUNT IN THE COMPLAINANTS ACCOUNT AND TAKE NECESSARY ACTION"
Online and Social Media Related Crime,Cyber Bullying  Stalking  Sexting,I took the loan from instead loan app for some emergency but that time I dont no that these companies are doing a fured and some times later I got a call from his side and abusing me to pay payment AM oclock then other then he will start call my contacts and abuse him that time I take normally and I took loan to the other company for his repayment and i again and again then i realized that I have big burden on me which I cant pay him because of my financial condition gose down and he harassing me and telling me that your going to pay or I call your contacts he started my calling contacts I want to pay him cash They are hacking my phone contacts and calling everyone and use abuse Language of all contact
