category,sub_category,crimeaditionalinfo
Online and Social Media Related Crime,EMail Phishing,Instant information is being reported  to bring to notice the hacking of Complainants Business EMail Account Data Breach Impersonation Identity Theft Denial of Services Criminal Breach of Trust Criminal Misappropriation of Property and Conspiracy committed by Ms Priyanka Madnani in cahoots with Pushpender Khajotia
Cyber Attack/ Dependent Crimes,Ransomware Attack,"The issue actually started when I got this email, which at first glance seemed like spam. I usually ignore such things, but for some reason, I opened it this time. Afterward, my phone started freezing, and it wasn’t normal. I thought it was a technical glitch, but now I’m not so sure. Looking back, maybe I should have paid more attention to the little details, but now it's too late. My accounts are compromised. The more I tried to fix it, the more problems came up. My bank account was unathorised, and then I got locked out of everything. This has really left me anxious and frustrated, I can’t sleep knowing my information is out there. I’ve even considered deleting all my accounts, but that’s not a solution. Even my laptop isn’t working right anymore. It’s so stange how everything just fell apart after that one email."
Online Financial Fraud,UPI Related Frauds,"FRAUD THROUGH  UPI PAYTM    	 	
BANK   	STATE BANK OF INDIA
ACCOUNT NUMBER  
TOTAL AMOUNT  
PLEASE HOLD  REVERSE TOTAL AMOUNT IN THE COMPLAINT ACCOUNT AND TAKE NECESSARY ACTION"
Online Financial Fraud,UPI Related Frauds,I paid for an pubg account after that he vanished and now he not even showing in telegram account disappeared his account not showing not from my father telegram I paid him  i also attached the paid screenshot
Online Financial Fraud,EWallet Related Fraud,"FRAUD THROUGH  EWallet Related Fraud	
BANK DHANI PAY 
AC  NO  
TOTAL AMOUNT 
PLEASE HOLD  REVERSE TOTAL AMOUNT IN THE COMPLAINT ACCOUNT AND TAKE NECESSARY ACTION 
"
Any Other Cyber Crime,Other,I SHEETAL KONDE FROM MUMBAI WITHOUT MY PERMISSION OB CASH LOAN TRANSFERED  IN MY ACCOUNT INSTEAD OF  AND IMMEDIDATE I HAVE TRANSFERED  TO UPI ID udiyesokhdfcbank THIS ID IS MENTION ON OB CASH LOAN AND MISS CHALITER KHAJURIYA  STARTED BLACKMAILING ME IF U WILL BE NOT GOING TO PAY FULL AMOUNT I WILL DO THIS AND THAT I WILL SHARE YOUR PICTURE ADDRESS CONTACT NUMBER TO OTHER TO HARRAS YOU AND EVEN SHE HACKED MY MOBILE ACESS MY ALL CONTACTS I REQUESTING TO  PLEASE STRICKLY TAKE ACTION AGAINST CHALITER KHAJURIYA AND OB CASH LOAN
Online Financial Fraud,UPI Related Frauds,Online hopping fraud
Online Financial Fraud,UPI Related Frauds,CALLER INFORMED THAT  AMOUNT FRAUD DONE BY SENDING WRONG SCAN 
Sexually Explicit Act,,                                                                            
Any Other Cyber Crime,Other,"My mobile was missing at near karimangalam The mobile is an oppo A The IMEI number of the phone are   The mobile number of the SIM used in the lost phone is  Approximate value of the new device of this model is Rs 

You are requested to kindly register the complaint and give me an attested copy of this complaint"
Online Financial Fraud,Fraud CallVishing,"The person Just claims that he is from the police department and    Talking to me in a rude behaviour and asking the money for unnecessary  Threatening for money and extortion  
I just want strict action should be taken like these people  as they are only responsible for the disrespect for the police department "
Online Financial Fraud,UPI Related Frauds,"Hi
I applied for loan i got very low eligibility so i ignored  Uninstalled the Support Loan App but still i have received  to my account on th Feb  from th March  onerds im Getting blackmail  wrong calls  using my photo  contacts list   asked me to pay amount So
I paid  to   manojjethvayesbank   but still they asked me to pay   Threating with my Contacts  data  Blackmailing me  Please help me out 
Thank you"
Online Financial Fraud,UPI Related Frauds,UPI Fraud of Rs 
Online Financial Fraud,Internet Banking Related Fraud,"Identity theft   Fake Customer Care Service Fraud   Any Others
victim saw a add in face book related about saree and victim want to buy that one after getting that saree she want to exchange that for this process victim call to customer care number and he sent one link to victim and opened that and enter all bank details  also enter upi pin later amount was debited from his account
"
Any Other Cyber Crime,Other,"I was at home on Dec   when someone used my ICICI credit card ending with  card and made  transactions  and 
Later I checked the statement and realised that someone used my card without my authorisation Then I reported my bank as well"
Online Financial Fraud,Internet Banking Related Fraud,"FRAUD THROUGH  INTERNET BANKING
BANK  STATE BANK OF INDIA
ACCOUNT NUMBER  
TOTAL AMOUNT  		
PLEASE HOLD REVERSE TOTAL AMOUNT IN THE COMPLAINT ACCOUNT AND TAKE NECESSARY ACTION
"
Online and Social Media Related Crime,Profile Hacking Identity Theft,I was trying to login my account but I was unable to do that When I tried to login via forget password the no linked to the my account is found different ending with  and when I tried it with email found a different mail linked to my account I am also unable to login my facebook account linked to the Smishra which may be accessed by the same person
Online Gambling  Betting,Online Gambling  Betting,I have gone through a app called as knc chain which is a investment related money generating app where if we invest  after few days we will get a lumpsum of approximately I invested in that around  but it has given me only  and trying to fraud in very futureSo many people has invested in it and they are going to lose it Actually it found geniune in the first and given the withdrawal in time and they have conducted a event where so many people invested lots of money in it And now they are going to close the app and steal the moneyIt is making fraud taking money from people by investments stating that return of  percent  percent and so onsoplease help me in the return of my money which I have invested in this fraud chain KNCchainLikely this chain has so many connects as it removes this app named knc they are going to place another app with another name and do the same fraud again and again People will lose the money if we donot take a legal actionThey are slowly becoming unactive so please take action as soon as possible before they lift the company in very futureThis is my humble request and hoping that you will definitely help me and the people who lost their money in this fraud chain
Online Financial Fraud,UPI Related Frauds,"FRAUD THROUGH UPI Phone Pe
BANK PUNJAB NATIONAL BANK
ACCOUNT NUMBER 
TOTAL AMOUNT 
PLEASE HOLDREVERSE TOTAL AMOUNT IN THE COMPLAINT ACCOUNT AND TAKE NECESSARY ACTION "
Hacking  Damage to computercomputer system etc,Unauthorised AccessData Breach,Sir they are tarnishing my image they have hacked my data from my mobile and are sending continuous messages to my contacts tarnishing as Fraud on my pic as attached  They are demanding money from my contacts and asking them to pay else they are threatening that they will hack even their data also Hence request you to please take stringent action against these imposters
Online Financial Fraud,UPI Related Frauds,"FRAUD THROUGH  UPI FRAUD PHONE PE
BANK    STATE BANK OF INDIA 
ACCOUNT NUMBER  
TOTAL AMOUNT  
PLEASE HOLD REVERSE TOTAL AMOUNT IN THE 
COMPLAINT ACCOUNT AND TAKE NECESSARY ACTION"
Online Financial Fraud,UPI Related Frauds,"i was  blackmailed with whtasap  recording   for money
Video call was done and they recorded the screenLater they sent the recorded video and asked for money I paid the money Later theystarted to ask for more"
Online Financial Fraud,UPI Related Frauds,"Online Frauds   Advertisement Portal Fraud  eCommerce platform  OLX
Victim placed a product in OLX and a fraudster contacted her that he will buy that product and asked her to send rupees and victim sent it and got it back and later she sent huge amount and it didnot get back and was frauded She lost Rs 
The fraudster was hesitant to do a direct UPI transfer or pay me cash He repeatedly asked me to enter my UPI pin"
Online Financial Fraud,UPI Related Frauds,TOTAL RS  FRAUD 
Online Financial Fraud,EWallet Related Fraud,Hello sir sorry upr or koi option ni tha islye mje kch bhi dalna jo mere sth hua vo option me ni tha islye m sorry for that please help me this incident happen on telegram uss bande ne muje  dene ko bole or crypto me profit earn krke dega bola to mne by mistake kr diye but fr  or mange bola ki ye   commission h mne bht mana kia but i had to pay fr usne or  charges mange govt ki fees to vo mne dene ko mna kr di ab vo mere pese return ni krra please help me i have more proofs
Online Financial Fraud,UPI Related Frauds,My BGMI ID banned which one I was using from  years when i mailed to BGMI they denied to unban then i searched on YouTube for unban BGMI account then i found this video on YouTube channel gaming zone x number given in discription for whats app chat i said will transfer money after unban he said trust me you have to pay first then i paid  after payment he blocked me
Any Other Cyber Crime,Other,I am getting a messege from   He is using my Pictures and writing very abusing language and sending it to my all contact list  He is threatening me  Please help me  He is saying very bad and abusive words for my mother and sister 
Online Financial Fraud,UPI Related Frauds,"A PHONE CALL ON MY NUMBER AND 
HE SAY HE SEND  RS TO MY SBI ACCOUNT AND SEND A FUND TRANSFER LINE ON MY PHONE  WHEN I CLICK ON THIS LINK FUND TRANSFER TO MY ACCOUNT TO IDFC FIRST BANK  
I ATTACH THE BANK SATAEMENT WITH THIS FIR"
Cyber Attack/ Dependent Crimes,Data Breach/Theft,"This all happened a few days after I accidentally clicked on a strange link on social media. I didn’t think much of it until things started going wrong. The next thing I knew, people were calling me asking if I had sent them strange messages, and I hadn’t touched my phone all day. Honestly, it’s such a mess, and I don’t even know where to start. I’ve contacted support, but they keep giving me the runaround. The more I tried to fix it, the more problems came up. My work account was notifiction, and then I got locked out of everything. I don’t think I’ve ever felt this violated before. My privacy is completely shattered, and I can’t do anything to make it stop. Even my laptop isn’t working right anymore. It’s so stange how everything just fell apart after that one email."
Online Financial Fraud,DebitCredit Card FraudSim Swap Fraud,I received a message from my bank that is your bank account has debited  and actualy they provide link for me job seeking and i click on that link amount showed rs only TENA RUPEES BUT THEY DEDUCTED  SIR
Online and Social Media Related Crime,Profile Hacking Identity Theft,My name is Piyush Kumar I want to complain regarding my sister instagram id and her instagram id is anuubha Someone has stolen some of her pictures from her id and made a no of fake account similer as of her id and uploaded her pictures with abusive words He is sending abusing words to her inbox as well as to all of her friends from her following list specially girls from her fake account which he has made He abuse very badly to them and to my sister and call whole night on instagram She had been facing these from the last  months The same he had done in the month of september last year she had left all that because of her examination  and he had stopped again he is doing the same thing to her to all of her friends by making id and uploading her pictures on id She has kept all of the abusive things and abusive contents which he had done before and of now too Sir she is student she has been disturbed and frightened cause of this all I hope you will work on it and take a strict action against him as soon as possible
Online Financial Fraud,Internet Banking Related Fraud,A MAN WITH MOBILE NOS    DUPED BY GIVING OFFER PLATINUM AIRTEL MOBILE NOS  HIS EMAIL WAS ADITYAJAINAIRTELCOM HE GIVEN BHARTI AIRTEL LTD GST  PAN NO  UNION BANK OF INDIA ACCOUNT TO DEPOSIT Rs   Please take appropriate action
Hacking  Damage to computercomputer system etc,Unauthorised AccessData Breach,"On  January  My facebook and Battleground mobile india account got and unauthorised access And now i am not able access my id but its still running without my permission
I have full proof for my id and against the hacker or culprit
 
Details about the hacker given below
His Name  Sonu Chaudhary
Fathers Name  Jagan lal Gharwal
Phone no  

Let me explain full story
The boy name Sonu Chaudhary access my Facebook account through which my Battle grounds mobile india was linked After that he crased my Facebook id and add his id in my BGMI account But the BGMI account totally registeres to me i have full proof for my account From past  years i am using my account

Please help me Government Of India is the last hope for me

Bgmi id name DRAGO I GOD
Bgmi id 
Face book id Kundu Tkd

Thank you"
Any Other Cyber Crime,Other,PAID PAYMENT OF  but the amount and screenshot is fake and the person has taken the product and blocked me the trasaction is done on whatsapp and payment screenshot is of google pay he has done this twice
Online Financial Fraud,EWallet Related Fraud,"FRAUD THROUGH  EWallet Related Fraud			 
BANK    AIRTEL PAYTM BANK
WALLET ID  
TOTAL AMOUNT  
PLEASE HOLD REVERSE TOTAL AMOUNT IN THE COMPLAINT ACCOUNT AND TAKE NECESSARY ACTION 
"
Online Financial Fraud,UPI Related Frauds,My wife had posted an add on OLX and she instatntly got some replies asking no to contact She shared my mobile no for communication and on WhatsApp chat they tried to do fraud by sharing QR code Initially they told that they will do online payment and when i agreed they told to check balance and then they shared Qr Code mentioned as Receive Rs  and told me to scan on phonepay to get it varified
Online Financial Fraud,UPI Related Frauds,"Hello sir madam this is akash 
I got massage On 
In WhatsApp about loan 
She told we are from JM financial pvt LTD 
If need any loans 

Welcome to JM Financial Service 
Dear Sir  Madam 
We Provide Personal Loan   Bussiness Loan All Over In India 
Interest Rate    Reducing  
For Registration Kindly Submit Your Documents in This WhatsApp No   
DOCUMENTS

 Aadhaar Card 
 Pan Card 
 Bank Ac Number 
  Photo Copy 
For Registration 
Loan Approval Just in Hrs Direct To Your Bank Account 
For More Information Call OR WhatsApp No 
 
with Regard

KISHOR G 


This is like I got massage from her and I have sent to my documents to her And She calls to me Today  Talk about This 

  PM    Total Loan Amount Rs    
Total Loan Period    Months 
Monthly EMI  Rs     
Processing Fees Rs    After Your Registration 
Total Interest Rs     For  Months 
Total Loan Amount Rs    
  PM    Total Loan Amount Rs   
Total Loan Period    Months 
Monthly EMI Rs    
Processing Fees Rs     After Your Registration 
Total Interest Rs     For  Months 
Total Loan Amount Rs    

And I told just i need L 
She tolds ok And I have asked question How can I trust you She tolds iam not called to you 
Iam just massaging in  WhatsApp 
And If u need take it or le"
RapeGang Rape RGRSexually Abusive Content,,"Respected Sir

A very serious matter I want to inform you Few person running or involve in some very shamefull activities by using few women at many places of kolkata gariahat ballygunge RUBY HOSPITAL BEHIND area KASBA ANANDAPUR QUEST MALL metropolis mall area ACROPOLISMALL area park circus FORUM MALL ELGIN RD Parkstreet MAIDAN AREA esplanade Garia jadavpur BEHALASAKHERBAZAR JOKA BANSDRONI  Rabindrasadanexide area  HARIDEVPUR triangular park lake mall area rashbehari area TOLLYGUNGE THAKURPUKUR BBD BAG DALHOUSIE AREA  and SALTLAKE

Their name 
SUBHRO SAHA AMLAN DATTA 
IZAZ AHMED Anirban


They officially work in a insurance office hdfclife  a hindustanpark ab gariahat shopping mall st floor beside of reliance trend building near gariahat more  but outside at several places  they involve in some shamefull activities last years

Sir a person SUBHRO SAHA forcefully involve few women employee ex FEMALE employee in such shamefull doing

At afternoon evening or after evening or night time they doing this shamefull activities

Many innocent people are TRAPPED and suffering in such dirty issue for long time
They are even  to lodge a complain against them because of  threatening and blackmailing ISSUE


From above  address PLACES and their mobile whatsapp no  you can easily trace and track their all activities You need to investigate Last years detail


Please help"
Online Financial Fraud,UPI Related Frauds,financial fraud  
Cyber Attack/ Dependent Crimes,Ransomware Attack,"My friend mentioned something like this happened to them a few months ago, but I thought it was a one-off. Then, suddenly, I got this weird notification asking me to update my password, but the message didn’t look like the usual ones I receive from the app. It looked a bit off. I don't know how, but it’s like they knew everything I was doing, even though I was trying to be careful. It’s terrifying to think about. The more I tried to fix it, the more problems came up. My bank account was transction, and then I got locked out of everything. I feel so helpless, like there’s nothing I can do to fix this. No matter how many times I change my password, it’s like someone’s always one step ahead. Even my tablet isn’t working right anymore. It’s so stange how everything just fell apart after that one email."
Online Financial Fraud,Fraud CallVishing," We Have Extended Finance Facility To Shaik Abdulla Dr No  Chintalarayuni Main Road TadpatriAnanthapurDt Andhra Pradesh 

 On dated  the abovementioned customer has reported to us that he has received a fake call from  to Our customer mobile No           and talking as our Mahindra finance manager and asking our customer to pay installment amount to him through his bank account number 

 	After receiving the information the company came to know that unknown person is trying to cheat innocent customer by online fraud by misusing the company name and cheating public The company suspecting the victims may be more Finally the company has decided to protect interest of the company and also the public and decided to give a criminal complaint for using our brand name of the company and thereby cheating innocent public"
Cyber Attack/ Dependent Crimes,Malware Attack,"I never imagined something like this could happen to me, especially since I'm so cautious. But then I started noticing that my online activity felt different, slower even. I can't even describe it well because everything seemed normal, except for the fact that I was constantly getting logged out of my accounts. I don't know how, but it’s like they knew everything I was doing, even though I was trying to be careful. It’s terrifying to think about. The more I tried to fix it, the more problems came up. My social media was frezzing, and then I got locked out of everything. I feel so helpless, like there’s nothing I can do to fix this. No matter how many times I change my password, it’s like someone’s always one step ahead. Even my phone isn’t working right anymore. It’s so stange how everything just fell apart after that one email."
Online Financial Fraud,DebitCredit Card FraudSim Swap Fraud,the fraudsters called saying they are calling from the hdfc main branch and that they have sent me an email last month regarding my reward points expiring Post which they told me that since it is the first time they are offering the cashback option But my card is not connected to the rewards system at the backend for which they will send me an OTP Once I gave the OTP the first transaction happened ie  and I asked they why is money getting debited from the card To which they said because of security reasons the amount has been put on hold but it will come back to my account She later sent another OTP saying I need to provide this for reverting the transaction post this the second amount ie  was debited from my card After that I asked them as to which branch are you calling from since this is a scam to which she responded saying I am barkha singh from the Mumbai Head Office I cut the call after this conversation The phone number that they contacted me from was   
Online Financial Fraud,Internet Banking Related Fraud,"citizen detail 
name  anil kumar 
add  naya gav  bhiwadi 
mob    
email akgmailcom
dist alwar 
pin code 
ps phulbag
froud by   atm card 
citizen bank detail 
ac no   icici   IFSC ICIC
 ATM NO   
transacation detail  

RFID NAHI HAI       TIME  PM   DATE    AMOUNT 
RFID NAHI HAI       TIME  PM   DATE    AMOUNT 

total froud  

 FROUDER DETAIL
MOBPHONE PAY       
summary   suchna  karta ne atm help ki liye google se no lekar call kiya tha  to unhone ek apps download karva kar froud kar liya hai  sayta 
"
Online Financial Fraud,Fraud CallVishing,"Hi

Saw an add in facebook about personal loan and I registeredThey called me in the name Kaveri financeMr Selvam  and MrSundarThey gave details about bank loan and i explained them that i cant get a loan through bank and hence they suggested I can go for private fiananceAfter all the discussion i forwarded them the loan documents The next day they said taht I need to pay processing fees and insuranceRs since its a small private finance and cannot take the risk for all I paid after having long conversation I asked them for loan agreement and insurance and they said that the money will be transferred first and then these will be given Waited for  a day to realise that its a fraudulent activity I called them again to know what they are going to ask next They sent a message again stating that I need to pay cgst of Rs I told them that I cannot pay anymore and i either need the docs or the amount returned No info so farThey just keep saying that I have to pay cgst after which they will do it

 transation id is 


i sent the amount to khemlathaass mngr
acc num  ifsc ubin branch barwala


the guy who spoke to me is selvam emp code upif  itpl main road agraharamwhitefieldbengalury karnataka "
Online Financial Fraud,UPI Related Frauds,UPI FRAUD RS  CANARA BANK 
RapeGang Rape RGRSexually Abusive Content,,"Respected Sir

A very serious matter I want to inform you Few person running or involve in some very shamefull activities by using few women at many places of kolkata gariahat ballygunge RUBY HOSPITAL BEHIND area KASBA ANANDAPUR QUEST MALL metropolis mall area ACROPOLISMALL area park circus FORUM MALL ELGIN RD Parkstreet MAIDAN AREA esplanade Garia jadavpur BEHALASAKHERBAZAR JOKA BANSDRONI  Rabindrasadanexide area  HARIDEVPUR triangular park lake mall area rashbehari area TOLLYGUNGE THAKURPUKUR BBD BAG DALHOUSIE AREA  and SALTLAKE

Their name 
SUBHRO SAHA AMLAN DATTA 
IZAZ AHMED Anirban


They officially work in a insurance office hdfclife  a hindustanpark ab gariahat shopping mall st floor beside of reliance trend building near gariahat more  but outside at several places  they involve in some shamefull activities last years

Sir a person SUBHRO SAHA forcefully involve few women employee ex FEMALE employee in such shamefull doing

At afternoon evening or after evening or night time they doing this shamefull activities

Many innocent people are TRAPPED and suffering in such dirty issue for long time
They are even  to lodge a complain against them because of  threatening and blackmailing ISSUE


From above  address PLACES and their mobile whatsapp no  you can easily trace and track their all activities You need to investigate Last years detail


Please help"
Online Financial Fraud,UPI Related Frauds,Respected sir I received whatsapp msg and i replied them they sent me a link and asked to register an account i have registered an account and they asked to share account details and they asked to deposit money to my account and purchase the product they had sent my money back with comission and after that they asked if i wish to continue to second level and i had deposited some more money and did the same process and they sent back my money and asked to enter to third level and after that they did not return my money and are asking for some more money inorder to get the total amount and if i refuse to pay they are threatening to lock my account and money forever
Any Other Cyber Crime,Other,DATE  KO MAINE HOME CREDIT KE LIYE GOOGLE PAR NUMBER NIKALA THA TO MERE PAS EK NUMBER SE PHONE AYA JISKA NO  YE HAI TO MAINE ISSE BAAT KI TO ISNE MUJHE EK LINK SEND KIYA JISPAR MAINE CLICK KIYA AUR PHIR MERE UPI ACCOUNT SE  RS KAT GAYE MY ACCOUNT NAME BANK OF BARODA ACCOUNT NO 
Online Financial Fraud,UPI Related Frauds,"Nameshivkesh meena 
 
Addgaavchandlai psbamanbas 
Dist sawai madhopur 
Pin  Email shivkeshmahargmailcom
 
Froud byphone pay 
 suchana karta ke pass jis no se call aaya vo no
 
suchana karta ka banksbi account no 

bob account  
suchana karta ka phone pay no 
sbi  date timeam 
transction idt utr
bob  date timeam transction idt utr
bob    date timeam transction idt utr
sbi   date timeam transction idt utr
total amount"
Online Financial Fraud,Internet Banking Related Fraud,Financial Fraud 
Online Financial Fraud,UPI Related Frauds,There was a headpones sell and i have purchesed one and make a online payment on phone pay  and after that day i am trying to contatct the seller the profile or a web page is not  working and on google map they provide  a fake location f  their office
